{
  "schema_version": "consensus-real-provider-acceptance-contract/3",
  "registry_version": "consensus-acceptance-executable-registry/1",
  "validator_registry_version": "consensus-acceptance-validator-registry/1",
  "scope": "disposable_consensus_real_provider_acceptance",
  "runtime_mode": "disposable_acceptance",
  "production_access": false,
  "steps": [
    {
      "step_id": "packet.artifact",
      "category": "preflight",
      "requirement_id": "REQ-EDEC5EAB5C8A180D",
      "mandatory": true,
      "applicable_roles": [],
      "applicable_providers": [],
      "applicable_models": [],
      "applicable_profiles": [],
      "protected_action": null,
      "expected_failure_code": null,
      "evidence_schema": "packet-verification/1",
      "implementation_module": "scripts/consensus-real-acceptance-steps.ts",
      "bound_source_modules": [
        "scripts/run-consensus-real-acceptance.ts",
        "lib/acceptance-requirement-evidence.ts",
        "lib/acceptance-semantic-validation.ts"
      ],
      "execution_phase": "harness",
      "lifecycle_phase": "pre_review",
      "implementation_reference": "acceptanceExecutableRegistry:packet.artifact",
      "validator_id": "validate:packet.artifact/1",
      "validator_configuration_identity": "c595c48382bff93f9d54f18c08247fc2558be946764daabcd2b6e2fdaff7f342",
      "validator_identity": "435ae3b5bcc08ebd08b8a20c6584efe0d7bf261a525a0140ea0cc1f49cd7bd9e",
      "required_evidence_fields": ["passCriteriaId", "observation", "details"],
      "pass_criteria_id": "pass:packet.artifact/1",
      "implementation_identity": "3f6b79cfe51fcb9a502ada9b9a12e52d8cb07841de5835528e51ca583b9e5f40",
      "timeout_ms": 0
    },
    {
      "step_id": "packet.artifact_metadata",
      "category": "preflight",
      "requirement_id": "REQ-A50E1D5E10B2C9DA",
      "mandatory": true,
      "applicable_roles": [],
      "applicable_providers": [],
      "applicable_models": [],
      "applicable_profiles": [],
      "protected_action": null,
      "expected_failure_code": null,
      "evidence_schema": "packet-verification/1",
      "implementation_module": "scripts/consensus-real-acceptance-steps.ts",
      "bound_source_modules": [
        "scripts/run-consensus-real-acceptance.ts",
        "lib/acceptance-requirement-evidence.ts",
        "lib/acceptance-semantic-validation.ts"
      ],
      "execution_phase": "harness",
      "lifecycle_phase": "pre_review",
      "implementation_reference": "acceptanceExecutableRegistry:packet.artifact_metadata",
      "validator_id": "validate:packet.artifact_metadata/1",
      "validator_configuration_identity": "094330f36a1e8011e42b89f976b7a689ab1f03d24a6eded5ebeec917dda8883a",
      "validator_identity": "e253148c674411caebb50ec27ed6a0706e32b2162ef3175340854ceb10f0778c",
      "required_evidence_fields": ["passCriteriaId", "observation", "details"],
      "pass_criteria_id": "pass:packet.artifact_metadata/1",
      "implementation_identity": "bf2aae1e3ffb6caa1ab443a03348a5220fd1a09b366556bbbba68ceb31d0a7c9",
      "timeout_ms": 0
    },
    {
      "step_id": "packet.capability_manifest",
      "category": "preflight",
      "requirement_id": "REQ-765B094EF8E06322",
      "mandatory": true,
      "applicable_roles": [],
      "applicable_providers": [],
      "applicable_models": [],
      "applicable_profiles": [],
      "protected_action": null,
      "expected_failure_code": null,
      "evidence_schema": "packet-verification/1",
      "implementation_module": "scripts/consensus-real-acceptance-steps.ts",
      "bound_source_modules": [
        "scripts/run-consensus-real-acceptance.ts",
        "lib/acceptance-requirement-evidence.ts",
        "lib/acceptance-semantic-validation.ts"
      ],
      "execution_phase": "harness",
      "lifecycle_phase": "pre_review",
      "implementation_reference": "acceptanceExecutableRegistry:packet.capability_manifest",
      "validator_id": "validate:packet.capability_manifest/1",
      "validator_configuration_identity": "67ee2983e4aed754fd7aa33297087d4bab460506d02d83d652463b3d7ca8a17a",
      "validator_identity": "d6015a8887e1a55f37078204f0bfe0799e0c8a7edf1d997696a700b1845aa5c2",
      "required_evidence_fields": ["passCriteriaId", "observation", "details"],
      "pass_criteria_id": "pass:packet.capability_manifest/1",
      "implementation_identity": "d9584845ee440d4870539f79670f830719556390a9feb60283d4464d46eea698",
      "timeout_ms": 0
    },
    {
      "step_id": "packet.source_manifest",
      "category": "preflight",
      "requirement_id": "REQ-D37A028F9365DDB4",
      "mandatory": true,
      "applicable_roles": [],
      "applicable_providers": [],
      "applicable_models": [],
      "applicable_profiles": [],
      "protected_action": null,
      "expected_failure_code": null,
      "evidence_schema": "packet-verification/1",
      "implementation_module": "scripts/consensus-real-acceptance-steps.ts",
      "bound_source_modules": [
        "scripts/run-consensus-real-acceptance.ts",
        "lib/acceptance-requirement-evidence.ts",
        "lib/acceptance-semantic-validation.ts"
      ],
      "execution_phase": "harness",
      "lifecycle_phase": "pre_review",
      "implementation_reference": "acceptanceExecutableRegistry:packet.source_manifest",
      "validator_id": "validate:packet.source_manifest/1",
      "validator_configuration_identity": "e8acf84d3fc84bf6912ad2ce2c66720e7c1874e93664bbac71e132d073e3523c",
      "validator_identity": "cf4bed5a38a5bf502bd76fb74c25f9756402358449fe78ee2017937e36fd615f",
      "required_evidence_fields": ["passCriteriaId", "observation", "details"],
      "pass_criteria_id": "pass:packet.source_manifest/1",
      "implementation_identity": "403fc771a513bc14f6079c562205267c0e119eb44b6ea0a2bc5709ad23001adb",
      "timeout_ms": 0
    },
    {
      "step_id": "packet.acceptance_contract",
      "category": "preflight",
      "requirement_id": "REQ-0976BE8D411F02E2",
      "mandatory": true,
      "applicable_roles": [],
      "applicable_providers": [],
      "applicable_models": [],
      "applicable_profiles": [],
      "protected_action": null,
      "expected_failure_code": null,
      "evidence_schema": "packet-verification/1",
      "implementation_module": "scripts/consensus-real-acceptance-steps.ts",
      "bound_source_modules": [
        "scripts/run-consensus-real-acceptance.ts",
        "lib/acceptance-requirement-evidence.ts",
        "lib/acceptance-semantic-validation.ts"
      ],
      "execution_phase": "harness",
      "lifecycle_phase": "pre_review",
      "implementation_reference": "acceptanceExecutableRegistry:packet.acceptance_contract",
      "validator_id": "validate:packet.acceptance_contract/1",
      "validator_configuration_identity": "8be4fd9b7e0cb9a83a2a0cb56ce7d9467d3169da3a3fa662a6be7b3b01074595",
      "validator_identity": "fc695216e99768893383540e2e4fc0c5b2a129c736fbadfd252a9785fa78dfae",
      "required_evidence_fields": ["passCriteriaId", "observation", "details"],
      "pass_criteria_id": "pass:packet.acceptance_contract/1",
      "implementation_identity": "bcd2630b64057710ea1168d3c1ca641b9c599895ef34cd4f5d3c663498338c00",
      "timeout_ms": 0
    },
    {
      "step_id": "registry.exact_hash",
      "category": "preflight",
      "requirement_id": "REQ-382837B0176F84F6",
      "mandatory": true,
      "applicable_roles": [],
      "applicable_providers": [],
      "applicable_models": [],
      "applicable_profiles": [],
      "protected_action": null,
      "expected_failure_code": null,
      "evidence_schema": "packet-verification/1",
      "implementation_module": "scripts/consensus-real-acceptance-steps.ts",
      "bound_source_modules": [
        "scripts/run-consensus-real-acceptance.ts",
        "lib/acceptance-requirement-evidence.ts",
        "lib/acceptance-semantic-validation.ts"
      ],
      "execution_phase": "harness",
      "lifecycle_phase": "pre_review",
      "implementation_reference": "acceptanceExecutableRegistry:registry.exact_hash",
      "validator_id": "validate:registry.exact_hash/1",
      "validator_configuration_identity": "0e8034f2c62ee95a93afeaabad3417962681acd6d43e45a4659af2ab2acf1dd7",
      "validator_identity": "b3f54ab02299e740deb37ebaa289a7e1e64d8fa2aac00fefcd9f8e7f6c5ad5a8",
      "required_evidence_fields": ["passCriteriaId", "observation", "details"],
      "pass_criteria_id": "pass:registry.exact_hash/1",
      "implementation_identity": "c649dc27c4f5bc44b30e81a9a51289c82d5508fe4106725bf4c1c79e87477160",
      "timeout_ms": 0
    },
    {
      "step_id": "registry.validity_window",
      "category": "preflight",
      "requirement_id": "REQ-A0D72C990A85B0A5",
      "mandatory": true,
      "applicable_roles": [],
      "applicable_providers": [],
      "applicable_models": [],
      "applicable_profiles": [],
      "protected_action": null,
      "expected_failure_code": null,
      "evidence_schema": "packet-verification/1",
      "implementation_module": "scripts/consensus-real-acceptance-steps.ts",
      "bound_source_modules": [
        "scripts/run-consensus-real-acceptance.ts",
        "lib/acceptance-requirement-evidence.ts",
        "lib/acceptance-semantic-validation.ts"
      ],
      "execution_phase": "harness",
      "lifecycle_phase": "pre_review",
      "implementation_reference": "acceptanceExecutableRegistry:registry.validity_window",
      "validator_id": "validate:registry.validity_window/1",
      "validator_configuration_identity": "3c775322044dd4bd7c1e1191533c1e264fd23c97180941b464c2edf42886492a",
      "validator_identity": "54421f1f188974fed594198ad0d95932cb43cd0bbc37282959db2d3a8feec46b",
      "required_evidence_fields": ["passCriteriaId", "observation", "details"],
      "pass_criteria_id": "pass:registry.validity_window/1",
      "implementation_identity": "76a6a2586ac44a1c1451aab0b86d31e34e442cddaabb74d7a724e0789a1ed7aa",
      "timeout_ms": 0
    },
    {
      "step_id": "registry.contract_hash",